[
  {"id":"nasa-uap-study-2023","designator":"NASA UAP Independent Study","date":"2023-09-14","date_precision":"day","time":null,"location":"NASA HQ, Washington D.C.","lat":38.88,"lng":-77.02,"geo_precision":"city","shape":"other","duration":null,"description":"NASA's independent study team published its UAP report, calling for better calibrated sensors and rigorous data, and finding no evidence of extraterrestrial origin while urging destigmatized scientific study.","witnesses":1,"source":{"agency":"NASA","collection":"NASA-UAP","url":"https://science.nasa.gov/uap/"},"theater":"US-Domestic","evidence":["document"],"status":"historical","tags":["NASA","study","science"]}
]
