[
  {"id":"nara-uap-collection","designator":"NARA UAP Collection","date":"2025-04-24","date_precision":"day","time":null,"location":"National Archives, College Park MD","lat":38.99,"lng":-76.94,"geo_precision":"city","shape":"other","duration":null,"description":"NARA released UAP records transferred from ODNI, OSD, FAA, and the Nuclear Regulatory Commission under the 2024 NDAA. Rolling additions to the UAP Collection. Set NARA_API_KEY to pull individual records.","witnesses":1,"source":{"agency":"NARA","collection":"NARA-UAP","url":"https://www.archives.gov/uap"},"theater":"US-Domestic","evidence":["document"],"status":"historical","tags":["NARA","archive","disclosure"]}
]
