[
  {"id":"fbi-hottel","designator":"Hottel Memo","date":"1950-03-22","date_precision":"day","time":null,"location":"Washington, D.C. (FBI HQ)","lat":38.9,"lng":-77.04,"geo_precision":"city","shape":"disc","duration":null,"description":"The most-viewed FBI Vault file. Agent Guy Hottel relayed an informant claim of three 'flying saucers' recovered in New Mexico, each ~50 ft, with occupants. Never substantiated by the FBI.","witnesses":1,"source":{"agency":"FBI","collection":"FBI-Vault","url":"https://vault.fbi.gov/UFO"},"theater":"US-Domestic","evidence":["document"],"status":"historical","tags":["FBI","vault","historical"]},
  {"id":"fbi-roswell-dallas","designator":"Dallas Field Office Memo","date":"1947-07-08","date_precision":"day","time":null,"location":"Roswell, NM (FBI)","lat":33.39,"lng":-104.52,"geo_precision":"city","shape":"disc","duration":null,"description":"FBI Dallas memo to HQ: an Air Force major reported a recovered 'flying disc' near Roswell, 'hexagonal in shape, suspended from a balloon ~20 ft in diameter.' Later included in PURSUE.","witnesses":5,"source":{"agency":"FBI","collection":"FBI-Vault","url":"https://vault.fbi.gov/UFO"},"theater":"US-Domestic","evidence":["document"],"status":"historical","tags":["FBI","vault","roswell","historical"]}
]
